{
  "schemaVersion": "1.0.0",
  "domains": [
    { "id": "identity", "label": "Identity", "description": "Authentication, authorization, accounts, and identity governance." },
    { "id": "endpoint", "label": "Endpoint", "description": "Endpoint detections, host activity, and vulnerability telemetry." },
    { "id": "network", "label": "Network", "description": "Network security controls, flows, name resolution, and traffic activity." },
    { "id": "cloud", "label": "Cloud", "description": "Cloud control-plane activity and cloud-native security findings." },
    { "id": "email-collaboration", "label": "Email and collaboration", "description": "Messaging, collaboration, and email security activity." },
    { "id": "applications-workloads", "label": "Applications and workloads", "description": "Application, workload, and enterprise platform activity." },
    { "id": "data-security", "label": "Data security", "description": "Data access, storage, databases, and data protection controls." },
    { "id": "infrastructure-platform", "label": "Infrastructure and platform", "description": "Infrastructure health, configuration, containers, and operational diagnostics." },
    { "id": "security-operations", "label": "Security operations", "description": "Alerts, incidents, posture, and Sentinel platform operations." },
    { "id": "threat-intelligence", "label": "Threat intelligence", "description": "Threat indicators, intelligence objects, and enrichment." }
  ],
  "logTypes": [
    { "id": "activity", "label": "Activity" },
    { "id": "alert", "label": "Alert" },
    { "id": "application", "label": "Application" },
    { "id": "audit", "label": "Audit" },
    { "id": "authentication", "label": "Authentication and sign-in" },
    { "id": "configuration", "label": "Configuration" },
    { "id": "container", "label": "Container and Kubernetes" },
    { "id": "data-access", "label": "Data access" },
    { "id": "diagnostic", "label": "Diagnostic" },
    { "id": "endpoint-telemetry", "label": "Endpoint telemetry" },
    { "id": "health", "label": "Health" },
    { "id": "network-flow", "label": "Network flow" },
    { "id": "posture", "label": "Posture" },
    { "id": "security-event", "label": "Security event" },
    { "id": "storage-access", "label": "Storage access" },
    { "id": "threat-indicator", "label": "Threat indicator" },
    { "id": "vulnerability", "label": "Vulnerability" }
  ],
  "categoryMappings": {
    "Application Logs": { "domainId": "applications-workloads", "logTypeId": "application" },
    "Cloud Control Plane": { "domainId": "cloud", "logTypeId": "audit" },
    "Cloud Security": { "domainId": "cloud", "logTypeId": "security-event" },
    "Configuration Management": { "domainId": "infrastructure-platform", "logTypeId": "configuration" },
    "Container & Kubernetes": { "domainId": "infrastructure-platform", "logTypeId": "container" },
    "Data Platform": { "domainId": "data-security", "logTypeId": "data-access" },
    "Data Security": { "domainId": "data-security", "logTypeId": "security-event" },
    "Email Security": { "domainId": "email-collaboration", "logTypeId": "security-event" },
    "Endpoint Detection": { "domainId": "endpoint", "logTypeId": "security-event" },
    "Endpoint Telemetry": { "domainId": "endpoint", "logTypeId": "endpoint-telemetry" },
    "Identity & Access": { "domainId": "identity", "logTypeId": "authentication" },
    "Infrastructure Diagnostics": { "domainId": "infrastructure-platform", "logTypeId": "diagnostic" },
    "IoT/OT Security": { "domainId": "infrastructure-platform", "logTypeId": "security-event" },
    "Network Flow": { "domainId": "network", "logTypeId": "network-flow" },
    "Network Security": { "domainId": "network", "logTypeId": "security-event" },
    "Platform Health": { "domainId": "security-operations", "logTypeId": "health" },
    "Posture Management": { "domainId": "security-operations", "logTypeId": "posture" },
    "SAP Security": { "domainId": "applications-workloads", "logTypeId": "audit" },
    "Security Alerts": { "domainId": "security-operations", "logTypeId": "alert" },
    "Storage Access": { "domainId": "data-security", "logTypeId": "storage-access" },
    "Threat Intelligence": { "domainId": "threat-intelligence", "logTypeId": "threat-indicator" },
    "Vulnerability Management": { "domainId": "endpoint", "logTypeId": "vulnerability" }
  },
  "tableOverrides": {}
}
